TYPE,SS,ADR,INFO,lng,lat,census_subnit,number_of_nearby_restaurants,number_of_bus_stops,number_of_MTR_stations,number_of_schools,number_of_commercial_facilities,number_of_government_facilities,number_of_religious_facilities,number_of_medical_facilities,number_of_hotel_facilities,mean_median_age,median_hs_income,mean_hs_size,labour_force_percent,chinese_percent,pop_m_percent,ten_oc_percent,rent_to_income_ratio
RL,BUDDY CAFE,"SHOP 8, G/F, KAM SHEK BUILDING, 44 SHEK YAM ROAD, KWAI CHUNG, NEW TERRITORIES",[],114.13996835897676,22.36911692766897,1041,4,0,0,1,7,0,0,5,3,49.80904607278519,22430,2.959564823209429,0.4419188824898909,0.9620144590123759,0.4818037005268962,0.5309156844968268,0.323
RL,CHAP SHING,"SHOP NO. C15, SECOND FLOOR, COMMERCIAL/ CAR PARK BLOCK (ALSO KNOWN AS TAI WO HAU COMMERCIAL CENTRE I), TAI WO HAU ESTATE, 15 TAI WO HAU ROAD, KWAI CHUNG, NEW TERRITORIES",[],114.11836023168564,22.371293037371387,994,14,2,0,0,2,2,0,0,1,52.57441956882255,32330,2.817757009345794,0.5306799336650083,0.961028192371476,0.45107794361525705,0.780373831775701,0.446
RL,榮式燒雞扒專門店,"SHOP NO. 19, G/F, KWAI FONG SHOPPING CENTRE, KWAI FONG ESTATE, KWAI CHUNG, NEW TERRITORIES",[],114.12995,22.358390000000043,1034,3,0,0,0,3,0,0,0,0,51.48771087841769,20140,2.8263729036501153,0.4676556137289122,0.9551483420593369,0.48417684700407215,0.0,0.13
RL,閒來吹水,"SHOP NO. 8, G/F, KWAI FOOK BUILDING, NOS. 5-23 LAI FONG STREET, KWAI CHUNG, NEW TERRITORIES",[],114.12678010488249,22.35956344397718,1033,17,1,0,2,7,0,0,3,0,39.21996215704825,26040,2.7200205867215645,0.49441816461684013,0.9581835383159887,0.44295175023651845,0.6181163149768399,0.349
RL,Yu Mai Soup Plus,"SHOP NO. 3, G/F, COMMERCIAL/CAR PARK BLOCK (ALSO KNOWN AS KWAI FONG PLAZA), KWAI FONG ESTATE , 177 HING FONG ROAD, KWAI CHUNG, NEW TERRITORIES",[],114.12817015970506,22.358618132937053,1034,4,0,0,2,4,1,0,0,0,51.48771087841769,20140,2.8263729036501153,0.4676556137289122,0.9551483420593369,0.48417684700407215,0.0,0.13
RL,翠河餐廳,"SHOP NO. 2, G/F, KWAI FONG PLAZA, KWAI FONG ESTATE, 177 HING FONG ROAD, KWAI CHUNG, NEW TERRITORIES",[],114.12817015970506,22.358618132937053,1034,4,0,0,2,4,1,0,0,0,51.48771087841769,20140,2.8263729036501153,0.4676556137289122,0.9551483420593369,0.48417684700407215,0.0,0.13
RL,CAFE 100% & Itamomo,"SHOP 324(PORTION A), 3/F, SHEK LEI SHOPPING CENTRE (PH 2), SHEK LEI ESTATE, KWAI CHUNG, NEW TERRITORIES",[],114.13831896806988,22.36492694000012,1045,5,3,0,1,5,1,0,2,0,51.36833505331957,18990,2.6728576682603897,0.4505675954592363,0.9647746818025456,0.48572411420708633,0.11658698050753953,0.117
RL,Soul Ginger,"SHOP NO. 18, G/F, KWAI FONG PLAZA, 177 HING FONG ROAD, KWAI CHUNG, KWAI CHUNG, NEW TERRITORIES",[],114.129785436266,22.3578730655638,1034,2,0,0,0,2,0,0,0,0,51.48771087841769,20140,2.8263729036501153,0.4676556137289122,0.9551483420593369,0.48417684700407215,0.0,0.13
RL,365小食部,"SHOP NO.29, G/F, ON SHING BUILDING, 19-31 TAI PAK TIN STREET, KWAI CHUNG, NEW TERRITORIES",[],114.13963559742068,22.367553493179173,1041,6,0,0,3,3,0,0,5,0,49.80904607278519,22430,2.959564823209429,0.4419188824898909,0.9620144590123759,0.4818037005268962,0.5309156844968268,0.323
RL,潮興正宗鹵味,"SHOP C, G/F, KWAI LAI BUILDING, NO. 37 SHEK YAM ROAD, KWAI CHUNG, NEW TERRITORIES",[],114.1397112860064,22.36872930655663,1041,6,0,0,1,6,0,0,4,3,49.80904607278519,22430,2.959564823209429,0.4419188824898909,0.9620144590123759,0.4818037005268962,0.5309156844968268,0.323
RL,Chiu Hing Noodle Shop,"SHOP G05A, G/F, WEALTHY GARDEN, NO. 204 HING FONG ROAD, KWAI CHUNG, NEW TERRITORIES",[],114.12713549757706,22.35900818480133,1033,6,1,0,0,4,0,0,2,0,39.21996215704825,26040,2.7200205867215645,0.49441816461684013,0.9581835383159887,0.44295175023651845,0.6181163149768399,0.349
RL,珍寶美食,"SHOP A11, G/F, KWAI CHUNG CENTRE, 100-102 KWAI HING ROAD, KWAI CHUNG, NEW TERRITORIES",[],114.13174000000004,22.36388000000005,1029,4,3,3,1,5,4,0,0,0,49.30263783269962,40090,2.8128342245989306,0.5175855513307985,0.9591254752851711,0.44866920152091255,0.8516042780748663,0.4
RL,Little Mario's,"SHOP NO. G02, G/F, LIFE@KCC, NOS. 72-76 KWAI CHEONG ROAD, KWAI CHUNG, NEW TERRITORIES",[],114.1322223069762,22.362417817284552,1051,14,1,1,2,1,5,0,0,0,36.83312807881774,41040,2.4546553808948004,0.5699507389162561,0.8655172413793103,0.5009852216748768,0.15598548972188633,0.044
RL,Lemon Cafe,"SHOP NOS. 10-12, G/F, HING KOK HOUSE BLOCK 1, KWAI HING ESTATE, NO. 2 WO KWAI LANE, KWAI CHUNG, NEW TERRITORIES",[],114.132480469594,22.36692786792615,1030,6,0,0,0,2,1,0,6,0,52.57833056101618,24890,2.69039869812856,0.4538031150763647,0.9623468924845002,0.4587932859519129,0.855573637103336,0.173
RL,葵涌辦館,"SHOP H, G/F, KAR PO MANSION, 499 CASTLE PEAK ROAD, KWAI CHUNG, NEW TERRITORIES",[],114.13358906010797,22.368363310754475,1026,6,0,0,3,3,0,0,4,0,40.080427446569175,19910,2.9423167848699765,0.475976217258557,0.9389362044030211,0.4456050136590069,0.5839243498817966,0.325
RL,GOLDEN CAFE,"SHOP C, D & E, G/F, KWONG FAI BUILDING, NOS. 93, 95 AND 97 SHEK YUM ROAD, KWAI CHUNG, NEW TERRITORIES",[],114.1392240459748,22.36975085100613,1041,9,1,0,0,9,0,0,3,3,49.80904607278519,22430,2.959564823209429,0.4419188824898909,0.9620144590123759,0.4818037005268962,0.5309156844968268,0.323
RL,譚仔三哥米線,"SHOP NO. B93, 1/F, KWAI CHUNG PLAZA, 7-11 KWAI FOO ROAD, KWAI CHUNG, NEW TERRITORIES",[],114.12717346759848,22.358296686950283,1035,14,0,0,0,1,2,0,2,0,52.04620410703174,31870,2.634426229508197,0.5059116365899191,0.9464841319228375,0.4268823895457374,0.8639344262295082,1.0
RL,WONG PAI BING SUTT,"SHOP 213, LEVEL 2, RETAIL ACCOMMODATION OF KLN. COMMERCE CTR, 51 KWAI CHEONG ROAD, KWAI CHUNG, NEW TERRITORIES",[],114.13281339878812,22.36199528554548,1051,11,0,0,2,5,4,0,0,0,36.83312807881774,41040,2.4546553808948004,0.5699507389162561,0.8655172413793103,0.5009852216748768,0.15598548972188633,0.044
RL,KFC,"SHOP NO. A109, 1/F, SHEK LEI SHOPPING CENTRE (PHASE 1), 6 WAI KEK STREET, KWAI CHUNG, NEW TERRITORIES",[],114.13831896806988,22.36492694000012,1045,5,3,0,1,5,1,0,2,0,51.36833505331957,18990,2.6728576682603897,0.4505675954592363,0.9647746818025456,0.48572411420708633,0.11658698050753953,0.117
RL,譚仔三哥米線,"SHOP NO. A108, 1/F, SHEK LEI SHOPPING CENTRE (PHASE 1), SHEK LEI ESTATE, NO.6 WAI KEK STREET, KWAI CHUNG, NEW TERRITORIES",[],114.13831896806988,22.36492694000012,1045,5,3,0,1,5,1,0,2,0,51.36833505331957,18990,2.6728576682603897,0.4505675954592363,0.9647746818025456,0.48572411420708633,0.11658698050753953,0.117
RL,Congee House,"SHOP NO. 1, G/F, COMMERCIAL/CAR PARK BLOCK (ALSO KNOWN AS KWAI FONG PLAZA), KWAI FONG ESTATE, 177 HING FONG ROAD, KWAI CHUNG, NEW TERRITORIES",[],114.12817015970506,22.358618132937053,1034,4,0,0,2,4,1,0,0,0,51.48771087841769,20140,2.8263729036501153,0.4676556137289122,0.9551483420593369,0.48417684700407215,0.0,0.13
RL,SAIZERIYA ITALIAN RESTAURANT,"SHOP 2, 3/F, SUN KWAI HING PLAZA, KWAI CHUNG, NEW TERRITORIES",[],114.13182000000006,22.362990000000025,1029,5,3,6,3,3,6,0,0,0,49.30263783269962,40090,2.8128342245989306,0.5175855513307985,0.9591254752851711,0.44866920152091255,0.8516042780748663,0.4
RL,SUSHI EXPRESS,"SHOP B318, 3/F, SHEK LEI SHOPPING CENTRE (PHASE 2), SHEK LEI ESTATE, NO. 110 TAI LOONG STREET, KWAI CHUNG, NEW TERRITORIES","['G', 'H']",114.13919646951332,22.365678168072225,1044,7,1,0,0,7,2,0,2,0,49.24215601611975,19110,2.786333012512031,0.4597582037996546,0.9639608520437536,0.4773747841105354,0.0,0.135
RL,"YU MAI, SOUP PLUS, CONGEE HOUSE","SHOP NO. B232A ON THE SECOND FLOOR OF SHEK LEI SHOPPING CENTRE (PHASE 2)(FORMING PART OFCOMMERCIAL/CAR PARK BLOCKS), SHEK LEI ESTATE, NO. 110 TAI LOONG STREET, KWAI CHUNG, NEW TERRITORIES",[],114.13919646951332,22.365678168072225,1044,7,1,0,0,7,2,0,2,0,49.24215601611975,19110,2.786333012512031,0.4597582037996546,0.9639608520437536,0.4773747841105354,0.0,0.135
RL,Cafe de Coral,"SHOP NO. B05, FIRST FLOOR, TAI WO HAU COMMERCIAL CENTRE(I), TAI WO HAU ESTATE, 15 TAI WO HAU ROAD, KWAI CHUNG, NEW TERRITORIES",[],114.12295000000006,22.366570000000024,1027,4,1,0,4,4,1,0,1,0,50.724247948951685,20500,2.5615878575598368,0.45715587967183224,0.9641446368884837,0.45085080522637494,0.09398715703444249,0.112
RL,KING PRAWN ASIAN RESTAURANT,"SHOP 9-10, 3/F, SUN KWAI HING PLAZA, KWAI CHUNG, NEW TERRITORIES",[],114.13182000000006,22.362990000000025,1029,5,3,6,3,3,6,0,0,0,49.30263783269962,40090,2.8128342245989306,0.5175855513307985,0.9591254752851711,0.44866920152091255,0.8516042780748663,0.4
RL,金港冰室,"SHOP A, G/F, CHEONG NIN BUILDING, 1013-1033 KWAI CHUNG ROAD, KWAI CHUNG, NEW TERRITORIES",[],114.13355310174336,22.3679175611436,1026,4,0,0,3,2,1,0,4,0,40.080427446569175,19910,2.9423167848699765,0.475976217258557,0.9389362044030211,0.4456050136590069,0.5839243498817966,0.325
RL,Lai Heung Yuen Cafe,"SHOP NO. B03 & B04, 1/F, TAI WO HAU COMMERCIAL CENTRE (I), TAI WO HAU ESTATE, 15 TAI WO HAU ROAD, KWAI CHUNG, NEW TERRITORIES",[],114.12295000000006,22.366570000000024,1027,4,1,0,4,4,1,0,1,0,50.724247948951685,20500,2.5615878575598368,0.45715587967183224,0.9641446368884837,0.45085080522637494,0.09398715703444249,0.112
RL,Cafe de Coral,"SHOP NO. B111, 1/F, SHEK LEI SHOPPING CENTRE (PHASE 2), SHEK LEI ESTATE, NO. 110 TAI LOONG STREET, KWAI CHUNG, NEW TERRITORIES",[],114.13919646951332,22.365678168072225,1044,7,1,0,0,7,2,0,2,0,49.24215601611975,19110,2.786333012512031,0.4597582037996546,0.9639608520437536,0.4773747841105354,0.0,0.135
RL,Aberdeen Cafe,"SHOP 11, 3/F , SUN KWAI HING PLAZA, KWAI CHUNG, NEW TERRITORIES",[],114.13182000000006,22.362990000000025,1029,5,3,6,3,3,6,0,0,0,49.30263783269962,40090,2.8128342245989306,0.5175855513307985,0.9591254752851711,0.44866920152091255,0.8516042780748663,0.4
RL,PU DONG XIAO GUAN,"SHOP M04, LEVEL 2, MEZZANINE OF THE RETAIL ACCOMMODATION, KOWLOON COMMERCE CENTRE, 51 KWAI CHEONG ROAD, KWAI CHUNG, NEW TERRITORIES",[],114.13261608878736,22.36154438106415,1051,11,0,0,2,1,4,0,0,0,36.83312807881774,41040,2.4546553808948004,0.5699507389162561,0.8655172413793103,0.5009852216748768,0.15598548972188633,0.044
RL,WING LOK ROAST KITCHEN,"SHOP NO. 11, G/F, KWAI FOOK BUILDING, NO. 5 LAI FONG STREET, KWAI CHUNG, NEW TERRITORIES",[],114.12678010488249,22.35956344397718,1033,17,1,0,2,7,0,0,3,0,39.21996215704825,26040,2.7200205867215645,0.49441816461684013,0.9581835383159887,0.44295175023651845,0.6181163149768399,0.349
RL,DELUXE RESTAURANT,"SHOP B210, B211 AND B212, 2/F, SHEK LEI SHOPPING CENTRE PHASE 2, SHEK LEI ESTATE, 110 TAI LOONG STREET, KWAI CHUNG, NEW TERRITORIES",[],114.13919646951332,22.365678168072225,1044,7,1,0,0,7,2,0,2,0,49.24215601611975,19110,2.786333012512031,0.4597582037996546,0.9639608520437536,0.4773747841105354,0.0,0.135
RL,星馬館,"SHOP NO. 6, G/F, KWAI FONG PLAZA, KWAI FONG ESTATE, KWAI CHUNG, NEW TERRITORIES",[],114.129785436266,22.3578730655638,1034,2,0,0,0,2,0,0,0,0,51.48771087841769,20140,2.8263729036501153,0.4676556137289122,0.9551483420593369,0.48417684700407215,0.0,0.13
RL,BEST LUCK SEAFOOD RESTAURANT (ROASTED GOOSE),"SHOP NOS. C02A, C02, C03 & C04, 2/F, TAI WO HAU COMMERCIAL CENTRE(I), TAI WO HAU ESTATE, 15 TAI WO HAU ROAD, KWAI CHUNG, NEW TERRITORIES",[],114.12295000000006,22.366570000000024,1027,4,1,0,4,4,1,0,1,0,50.724247948951685,20500,2.5615878575598368,0.45715587967183224,0.9641446368884837,0.45085080522637494,0.09398715703444249,0.112
RL,泰原味,"SHOP NOS. B206 & B207, 2/F, SHEK LEI SHOPPING CENTRE (PHASE 2), SHEK LEI ESTATE, 110 TAI LOONG STREET, KWAI CHUNG, NEW TERRITORIES",[],114.13919646951332,22.365678168072225,1044,7,1,0,0,7,2,0,2,0,49.24215601611975,19110,2.786333012512031,0.4597582037996546,0.9639608520437536,0.4773747841105354,0.0,0.135
RL,中興牛雜達人,"SHOPSTALL NO. 13, G/F, SHEK LEI SHOPPING CENTRE, SHEK LEI (I) ESTATE, KWAI CHUNG, NEW TERRITORIES",[],114.13831896806988,22.36492694000012,1045,5,3,0,1,5,1,0,2,0,51.36833505331957,18990,2.6728576682603897,0.4505675954592363,0.9647746818025456,0.48572411420708633,0.11658698050753953,0.117
RL,TUNG FONG SIU KEE YUEN,"SHOP B201,  2/F , SHEK LEI SHOPPING CENTRE (PHASE 2), SHEK LEI ESTATE, NO. 110 TAI LOONG STREET, KWAI CHUNG, NEW TERRITORIES",[],114.13919646951332,22.365678168072225,1044,7,1,0,0,7,2,0,2,0,49.24215601611975,19110,2.786333012512031,0.4597582037996546,0.9639608520437536,0.4773747841105354,0.0,0.135
RL,宏發軒,"SHOP 4, G/F, CHEONG SHEN MANSION, 113/117 & 121/127 TAI LOONG STREET, KWAI CHUNG, NEW TERRITORIES",[],114.1384787271444,22.366170143879103,1041,7,1,0,1,10,2,0,2,0,49.80904607278519,22430,2.959564823209429,0.4419188824898909,0.9620144590123759,0.4818037005268962,0.5309156844968268,0.323
RL,McDonald's Restaurant,"SHOP NOS. B013-B016, G/F, SHEK LEI SHOPPING CENTRE (PHASE2), SHEK LEI ESTATE, NO. 110 TAI LOONG STREET, KWAI CHUNG, NEW TERRITORIES",[],114.13919646951332,22.365678168072225,1044,7,1,0,0,7,2,0,2,0,49.24215601611975,19110,2.786333012512031,0.4597582037996546,0.9639608520437536,0.4773747841105354,0.0,0.135
RL,E POT,"SHOP NOS. 601-610, LEVEL 6, METROPLAZA, 223 HING FONG ROAD, KWAI FONG, KWAI CHUNG, KWAI CHUNG, NEW TERRITORIES","['G', 'H']",114.12614000000008,22.357700000000023,1035,5,0,0,0,1,2,0,0,0,52.04620410703174,31870,2.634426229508197,0.5059116365899191,0.9464841319228375,0.4268823895457374,0.8639344262295082,1.0
RL,Genki Sushi,"SHOP NO. 43 (PORTION) & SHOP NOS. 44-48, G/F, HO CHUCK CENTRE, 2-10 KWAI YI ROAD, KWAI CHUNG, NEW TERRITORIES","['G', 'H']",114.12757136784568,22.35583548448088,1037,4,4,3,0,5,0,0,0,0,38.91911101083032,40440,2.503954802259887,0.5697202166064982,0.9510379061371841,0.4699909747292419,0.7056497175141243,0.389
RL,Yakiniku Like,"SHOP NO. 112, LEVEL 1, METROPLAZA, 223 HING FONG ROAD, KWAI CHUNG, NEW TERRITORIES",[],114.12701010430555,22.35726034844167,1035,20,8,3,0,1,2,0,0,0,52.04620410703174,31870,2.634426229508197,0.5059116365899191,0.9464841319228375,0.4268823895457374,0.8639344262295082,1.0
RL,Nittaya Restaurant,"SHOP 167, LEVEL 1, METROPLAZA, 223 HING FONG ROAD, KWAI CHUNG, NEW TERRITORIES",[],114.12701010430555,22.35726034844167,1035,20,8,3,0,1,2,0,0,0,52.04620410703174,31870,2.634426229508197,0.5059116365899191,0.9464841319228375,0.4268823895457374,0.8639344262295082,1.0
RL,DK PIZZA CAFE,"SHOP B, G/F, YAU SHING BUILDING, NOS. 501/503 & 507/511 CASTLE PEAK ROAD, KWAI CHUNG, NEW TERRITORIES",[],114.13363557967062,22.36869418638232,1026,5,0,0,3,3,0,0,4,0,40.080427446569175,19910,2.9423167848699765,0.475976217258557,0.9389362044030211,0.4456050136590069,0.5839243498817966,0.325
RL,NEW KAM FUNG RESTAURANT,"SHOP A-C, G/F, 113-117 SHEK YAM ROAD, KWAI CHUNG, NEW TERRITORIES",[],114.1385843391244,22.37029973993557,1041,1,2,0,3,7,1,0,3,0,49.80904607278519,22430,2.959564823209429,0.4419188824898909,0.9620144590123759,0.4818037005268962,0.5309156844968268,0.323
RL,極之雞煲烤魚涮涮鍋,"SHOP 202, 2/F, WEALTHY GARDEN, 208 HING FONG ROAD, KWAI CHUNG, NEW TERRITORIES",[],114.12713549757706,22.35900818480133,1033,6,1,0,0,4,0,0,2,0,39.21996215704825,26040,2.7200205867215645,0.49441816461684013,0.9581835383159887,0.44295175023651845,0.6181163149768399,0.349
RL,源興燒味小館,"SHOP A, G/F, 109-115 WO TONG TSUI STREET, KWAI CHUNG, NEW TERRITORIES",[],114.13257962750856,22.3673724859801,1026,12,0,0,0,4,1,0,6,0,40.080427446569175,19910,2.9423167848699765,0.475976217258557,0.9389362044030211,0.4456050136590069,0.5839243498817966,0.325
RL,Ngan Lung Restaurant,"SHOP 106A, 1/F, KWAI SHING EAST SHOPPING CENTRE, KWAI SHING EAST ESTATE, KWAI CHUNG, NEW TERRITORIES",[],114.12731000000008,22.364640000000065,1031,6,1,0,1,3,1,0,2,0,50.7336359292881,19040,2.7654381084840054,0.43780018608393895,0.9638142178187945,0.46136243619081146,0.021001390820584144,0.124
RL,No Record,"SHOPSTALL NO. 10, G/F, SHEK LEI SHOPPING CENTRE, SHEK LEI (I) ESTATE, KWAI CHUNG, NEW TERRITORIES",[],114.13831896806988,22.36492694000012,1045,5,3,0,1,5,1,0,2,0,51.36833505331957,18990,2.6728576682603897,0.4505675954592363,0.9647746818025456,0.48572411420708633,0.11658698050753953,0.117
RL,Sushiro Kwai Fong,"SHOP 176-177, 1/F, METROPLAZA, 223 HING FONG ROAD, KWAI FONG, KWAI CHUNG, NEW TERRITORIES","['G', 'H']",114.12614000000008,22.357700000000023,1035,5,0,0,0,1,2,0,0,0,52.04620410703174,31870,2.634426229508197,0.5059116365899191,0.9464841319228375,0.4268823895457374,0.8639344262295082,1.0
RL,No Record,"SHOP 201, 2/F, WEALTHY GARDEN, 208 HING FONG ROAD, KWAI CHUNG, NEW TERRITORIES",[],114.12713549757706,22.35900818480133,1033,6,1,0,0,4,0,0,2,0,39.21996215704825,26040,2.7200205867215645,0.49441816461684013,0.9581835383159887,0.44295175023651845,0.6181163149768399,0.349
RR,康樂,"BLOCK D, TSUEN FAT MANSION, TSUEN HING PATH, G/F., HOI PA STREET, TSUEN WAN, NEW TERRITORIES",[],114.11547233076556,22.372521824376904,990,29,0,0,2,2,0,0,0,0,49.59867629362214,21140,2.738958470665788,0.5345367027677497,0.8974729241877256,0.5181708784596871,0.5346077785102176,0.316
RR,冠生園,"NO. 40A, SIDE LANE OF TAK WAH STREET, G/F., TSUEN WAN, NEW TERRITORIES",[],114.11897990004174,22.36904781080445,1013,4,0,0,7,1,0,0,6,0,35.807063851181496,17250,2.4616336633663365,0.4072398190045249,0.918552036199095,0.48366013071895425,0.2264851485148515,0.365
RR,雲南,"96B HEUNG WO STREET, G/F, TSUEN WAN, NEW TERRITORIES",[],114.1120943399668,22.37132216448491,997,16,0,0,0,1,1,0,0,0,36.811619718309856,21300,2.837162837162837,0.4524647887323944,0.9846830985915493,0.47746478873239434,0.4125874125874126,0.282
RR,嘉樂,"40 SAN TSUEN STREET, G/F, SHOP B, TSUEN WAN, NEW TERRITORIES",[],114.11472709575423,22.3695374896608,999,8,2,0,3,4,0,0,1,4,37.50052410901468,23520,2.846911369740376,0.509748427672956,0.9410901467505242,0.4329140461215933,0.41539838854073413,0.312
RR,牛欄牛什粉麵,"132 SHA TSUI ROAD, G/F., TSUEN WAN, NEW TERRITORIES",[],114.11173173883545,22.372132233517306,997,4,1,0,0,1,0,0,1,0,36.811619718309856,21300,2.837162837162837,0.4524647887323944,0.9846830985915493,0.47746478873239434,0.4125874125874126,0.282
RR,廣發,"SHOP NO. 4-5, SHEK FONG HOUSE, G/F., SHEK WAI KOK ESTATE, TSUEN WAN, NEW TERRITORIES",[],114.12404441932404,22.37466377782387,1022,1,0,0,3,7,2,0,1,0,52.59891961698375,17480,2.5394336906095023,0.44179160892024694,0.9652261559783294,0.4459493511402293,0.0,0.105
RR,誠信茶餐廳,"G/F., NO. 204 YAU MA HOM ROAD, KWAI CHUNG, TSUEN WAN, NEW TERRITORIES",[],114.13284701021983,22.371773655699457,1019,0,0,0,0,1,0,0,0,0,48.563747228381374,21940,2.9381107491856677,0.4672949002217295,0.9866962305986696,0.44401330376940135,0.5684039087947883,0.366
RR,榮安,"G/F.,  SHOP B, WING ON BUILDING, NO. 24 TAI HO ROAD, TSUEN WAN, NEW TERRITORIES",[],114.11596744978613,22.37240351381358,990,10,0,0,1,2,1,0,1,0,49.59867629362214,21140,2.738958470665788,0.5345367027677497,0.8974729241877256,0.5181708784596871,0.5346077785102176,0.316
RR,PENANG SPICY GARDEN,"SHOP NO. 5, G/F, CHEONG ON BUILDING, 186-200 SAI LAU KOK ROAD, TSUEN WAN, NEW TERRITORIES",[],114.12009,22.37131000000005,1002,18,0,0,3,1,0,0,1,1,51.67946058091286,30150,3.055790363482671,0.49017980636237896,0.94716459197787,0.4553250345781466,0.7396449704142012,0.448
RR,花姐廚房,"SHOP NO. 4, G/F, CHEONG ON BUILDING, TSUEN CHEONG CENTRE, 186-200 SAI LAU KOK ROAD, TSUEN WAN, NEW TERRITORIES",[],114.1199242109991,22.371355859735687,1002,12,0,0,0,1,0,0,0,1,51.67946058091286,30150,3.055790363482671,0.49017980636237896,0.94716459197787,0.4553250345781466,0.7396449704142012,0.448
RR,為食貓車仔麵,"SHOP S52, UPPER G/F, SHOPPING CENTRE, TSUEN WAN CENTRE, 87-105 TSUEN KING CIRCUIT, TSUEN WAN, NEW TERRITORIES",[],114.1072735721745,22.37821766286073,979,3,1,0,4,2,0,0,1,0,39.093134524834184,31900,2.6611425491781193,0.5120247076097413,0.9548883600830338,0.4730899701280948,0.7631366208569119,0.325
RR,蘭香,"G/F, 36 SAN TSUEN STREET, TSUEN WAN, NEW TERRITORIES",[],114.11463548155253,22.369587487713247,999,9,1,0,3,4,0,0,1,2,37.50052410901468,23520,2.846911369740376,0.509748427672956,0.9410901467505242,0.4329140461215933,0.41539838854073413,0.312
RR,雪山咖啡館,"G/F, NO. 28 KWOK SHUI ROAD, HAM TIN VILLAGE, TSUEN WAN, NEW TERRITORIES",[],114.12911519139315,22.37172679590846,1020,0,0,0,0,6,0,0,0,0,38.22567396798652,46120,3.0319284802043422,0.649536647009267,0.8934288121314238,0.4949452401010952,0.41379310344827586,0.187
RR,千色車仔麵,"G/F., NO. 49 SHIU WO STREET, TSUEN WAN, NEW TERRITORIES",[],114.11858235211974,22.371670432561857,994,14,3,0,0,2,5,0,0,1,52.57441956882255,32330,2.817757009345794,0.5306799336650083,0.961028192371476,0.45107794361525705,0.780373831775701,0.446
RR,超記,"NO. 30, G/F., BLOCK B, WAH TAT BUILDING, HOI PA STREET, TSUEN WAN, NEW TERRITORIES",[],114.11203315207364,22.37371586839376,991,10,1,0,2,10,0,0,0,0,36.88699165797706,17500,2.705218617771509,0.4692387904066736,0.8852971845672576,0.49061522419186654,0.3300423131170663,0.308
RR,Tso Kung Tam Outdoor Recreation Centre,"LEVEL 1 (PORTION) & LEVEL 2 (PORTION)TSO KUNG TAM OUTDOOR RECREATION CENTRE, ROUTE TWISK, TSO KUNG TAM, TSUEN WAN, NEW TERRITORIES",[],114.10604579099736,22.38596547506096,979,1,0,0,0,1,0,0,0,1,39.093134524834184,31900,2.6611425491781193,0.5120247076097413,0.9548883600830338,0.4730899701280948,0.7631366208569119,0.325
RR,全記餐廳,"NO.55, G/F, SHAM TSENG SUN TSUEN, LOT 220, D.D. 390 AND THE OUTSIDE SEATING ACCOMODATION AT SHOP FRONT, SHAM TSENG, TSUEN WAN, NEW TERRITORIES",['A'],114.10723583900004,22.374444478000044,988,3,0,0,0,0,0,0,0,0,36.55153917910448,14630,2.977777777777778,0.4216417910447761,0.9169776119402985,0.5,0.17222222222222222,0.211
RR,富裕,"SHOP NO. 3, G/F, NO. 47 TAI PA STREET, TSUEN WAN, NEW TERRITORIES",[],114.111255479097,22.37158057855981,997,9,0,0,1,0,0,0,1,0,36.811619718309856,21300,2.837162837162837,0.4524647887323944,0.9846830985915493,0.47746478873239434,0.4125874125874126,0.282
RR,上海津味,"SHOP NOS. 53-54, WEALTHY GARDEN SHOPPING ARCADE, PLOT B, TSUEN KWAI STREET, TSUEN WAN, NEW TERRITORIES",[],114.12165000000005,22.36949000000004,996,9,0,0,0,4,1,0,2,0,50.25028304557034,28140,2.8309294871794872,0.5162751202943674,0.9736767619586754,0.4656099632040759,0.7620192307692307,0.444
RR,發太,"SHOP NO.9 (PORTION) & 10 (PORTION), ON FU BUILDING, G/F, LO TAK COURT, TSUEN WAN, NEW TERRITORIES",[],114.11570542989227,22.37323191022293,990,6,2,1,1,0,2,0,0,0,49.59867629362214,21140,2.738958470665788,0.5345367027677497,0.8974729241877256,0.5181708784596871,0.5346077785102176,0.316
RR,鴻記餐廳,"G/F, 61, SHAM TSENG AND THE OUTSIDE SEATING ACCOMODATION AT SHOP FRONT, TSUEN WAN, NEW TERRITORIES",['A'],114.06104892500002,22.370309176000035,1061,2,0,0,0,2,0,0,0,0,37.308040770101925,29390,3.109154929577465,0.49037372593431483,0.956964892412231,0.4881087202718007,0.47183098591549294,0.227
RR,榮泰茶餐廳,"SHOP NO. 60、63 & 63A, G/F, PODIUM B, WEALTHY GARDEN, TSUEN WAN, NEW TERRITORIES",[],114.12172488600004,22.36921235200004,996,10,0,0,0,3,1,0,2,0,50.25028304557034,28140,2.8309294871794872,0.5162751202943674,0.9736767619586754,0.4656099632040759,0.7620192307692307,0.444
RR,阿甘車仔麵,"SHOP NO. 120C, G/F, PODIUM B OF RIVIERA GARDENS, TSUEN WAN, NEW TERRITORIES",[],114.11329374730312,22.36296395453807,1008,7,0,0,3,2,0,0,0,0,49.34173783996608,42630,3.0197548929943294,0.5439457265733842,0.9420316191168454,0.4377006481313223,0.7987927565392354,0.192
RR,Sweeties Dessert,"SHOP NO. 13B AND 15, G/F, PLOT A, WEALTHY SHOPPING ARCADE, 10A TSUEN KWAI STREET, TSUEN WAN, NEW TERRITORIES",[],114.12178541259924,22.369197813034617,996,10,0,0,0,3,1,0,2,0,50.25028304557034,28140,2.8309294871794872,0.5162751202943674,0.9736767619586754,0.4656099632040759,0.7620192307692307,0.444
RR,山西刀削麵店,"G/F, BLOCK B, TSUEN FAT BUILDING, 15 TSUEN HING PATH, TSUEN WAN, NEW TERRITORIES",[],114.11547233076556,22.372521824376904,990,29,0,0,2,2,0,0,0,0,49.59867629362214,21140,2.738958470665788,0.5345367027677497,0.8974729241877256,0.5181708784596871,0.5346077785102176,0.316
RR,大家姐,"SHOP B86-B87, 1/F, TSUEN FUNG CENTRE, 144-172 CASTLE PEAK ROAD, TSUEN WAN, NEW TERRITORIES",[],114.11858235211974,22.371670432561857,994,14,3,0,0,2,5,0,0,1,52.57441956882255,32330,2.817757009345794,0.5306799336650083,0.961028192371476,0.45107794361525705,0.780373831775701,0.446
RR,蘭苑饎館,"SHOP NO. 10, G/F, BRIGHTON PLACE, 23 SHIU WO STREET, TSUEN WAN, NEW TERRITORIES",[],114.11739421734468,22.372343289839264,993,9,4,0,0,3,2,0,1,3,39.74262339055794,18530,2.341708542713568,0.43508583690987124,0.9721030042918455,0.47585836909871243,0.49120603015075376,0.324
RR,良記粉麵,"G/F, NO. 53 SHAM TSENG VILLAGE, TSUEN WAN, NEW TERRITORIES",[],114.05889892673996,22.367404923945383,1061,10,2,0,0,5,1,0,0,0,37.308040770101925,29390,3.109154929577465,0.49037372593431483,0.956964892412231,0.4881087202718007,0.47183098591549294,0.227
RR,認真棧,"SHOP P8A, LEVEL 1, PARK ISLAND-PIER, 8 PAK LAI ROAD, MA WAN, TSUEN WAN, NEW TERRITORIES",[],114.0627569491336,22.354128701777256,1741,4,1,0,0,0,0,0,0,0,38.2863860187278,56720,2.5312627707396813,0.5796738779463998,0.8264449467226348,0.4300936390054892,0.695136902329383,0.246
RR,川味美食,"SHOP NOS. 43, 44 & 64, 1/F, CHEONG NING ARCADE, TSUEN CHEONG CENTRE, 202-216 SAI LAU KOK ROAD, TSUEN WAN, NEW TERRITORIES",[],114.12033056566509,22.3709512652694,1002,12,0,0,3,4,0,0,2,0,51.67946058091286,30150,3.055790363482671,0.49017980636237896,0.94716459197787,0.4553250345781466,0.7396449704142012,0.448
RR,Bar Pacific,"G/F., NO. 415 CASTLE PEAK ROAD, TSUEN WAN, NEW TERRITORIES",[],114.11242483840904,22.37475074006932,989,3,0,0,3,3,1,0,0,0,52.33464265850945,15570,2.268054241564175,0.4140711902113459,0.9760845383759733,0.457174638487208,0.013875748975086723,0.114
RR,越斗越南湯粉,"SHOP D, G/F, FULLYTECH CENTRE, 18 TAK HOI STREET, TSUEN WAN, NEW TERRITORIES",[],114.11739949794368,22.369987807408904,1005,14,1,0,0,3,2,0,0,3,53.18856655290102,19040,3.7684887459807075,0.3250853242320819,0.9223549488054608,0.4641638225255973,0.3247588424437299,0.3
